{
  "$schema": "https://json-schema.org/draft/2020-12/schema",
  "title": "Instruction Pack",
  "type": "object",
  "required": [
    "id",
    "name",
    "description",
    "category",
    "tags",
    "instructionsFile",
    "knowledgeDir"
  ],
  "properties": {
    "id": { "type": "string", "minLength": 1 },
    "name": { "type": "string", "minLength": 1 },
    "description": { "type": "string", "minLength": 1 },
    "category": { "type": "string", "minLength": 1 },
    "tags": {
      "type": "array",
      "items": { "type": "string" }
    },
    "instructionsFile": { "type": "string", "minLength": 1 },
    "knowledgeDir": { "type": "string", "minLength": 1 }
  },
  "additionalProperties": true
}
