{
  "id": "depression-screening",
  "name": "Depression Screening",
  "description": "Use when screening for depression symptoms (low mood, anhedonia, fatigue, sleep changes, appetite changes), assessing severity for treatment planning, tracking treatment response, or patient has positive PHQ-9 Item 9 (suicidal ideation). Provides PHQ-9 (comprehensive) and PHQ-2 (brief) assessments.",
  "category": "screening",
  "tags": [
    "depression",
    "phq-9",
    "phq-2",
    "mood",
    "low-mood",
    "anhedonia",
    "suicidal-ideation",
    "item-9",
    "fatigue",
    "sleep-changes",
    "treatment-monitoring",
    "screening",
    "mental-health"
  ],
  "instructionsFile": "instructions.md",
  "knowledgeDir": "knowledge"
}
