{
  "id": "substance-screening",
  "name": "Substance Use Screening",
  "description": "Use when screening for alcohol or drug use concerns (heavy drinking, cravings, loss of control, withdrawal symptoms, functional impairment), assessing substance use severity, determining level of care, or patient reports substance-related problems. Provides AUDIT-C (alcohol brief) and DAST-10 (drugs comprehensive) assessments.",
  "category": "screening",
  "tags": [
    "substance-use",
    "alcohol",
    "drugs",
    "audit-c",
    "dast-10",
    "addiction",
    "cravings",
    "withdrawal",
    "heavy-drinking",
    "loss-of-control",
    "screening",
    "mental-health"
  ],
  "instructionsFile": "instructions.md",
  "knowledgeDir": "knowledge"
}
