{
  "id": "intake-interview",
  "name": "Intake Interview",
  "description": "Use when conducting initial patient intake, gathering comprehensive history, establishing therapeutic rapport, assessing safety and risk factors, or need structured interview framework. Provides HEADSS assessment (adolescents), biopsychosocial interview template, and safety protocols.",
  "category": "clinical-workflow",
  "tags": [
    "intake",
    "interview",
    "assessment",
    "biopsychosocial",
    "headss",
    "initial-visit",
    "history-taking",
    "rapport",
    "safety-assessment",
    "workflow",
    "mental-health"
  ],
  "instructionsFile": "instructions.md",
  "knowledgeDir": "knowledge"
}
